{
  "api_version": 1,
  "colors": {
    "dark": {
      "accent": "#6cc3a8",
      "accent_text": "#0f1a16",
      "bg": "#151412",
      "border": "#3d3a35",
      "error_bg": "#3a1a16",
      "error_text": "#ffb4a9",
      "focus": "#8ab4ff",
      "muted": "#b3ada3",
      "surface": "#22201d",
      "text": "#f1eee9"
    },
    "light": {
      "accent": "#2f6f5e",
      "accent_text": "#ffffff",
      "bg": "#f4f2ee",
      "border": "#d6d1c8",
      "error_bg": "#fbe9e7",
      "error_text": "#8a1c12",
      "focus": "#1d5fd1",
      "muted": "#5f5a52",
      "surface": "#ffffff",
      "text": "#1f1d1a"
    },
    "night": {
      "accent": "#6cc3a8",
      "accent_text": "#0f1a16",
      "bg": "#000000",
      "border": "#2a2825",
      "error_bg": "#3a1a16",
      "error_text": "#ffb4a9",
      "focus": "#8ab4ff",
      "muted": "#7d786f",
      "surface": "#121110",
      "text": "#a8a298"
    }
  },
  "dir": "ltr",
  "font": {
    "family": "system-ui",
    "household": "system"
  },
  "household_colors": {
    "accent": "#c8902f",
    "primary": "#d2542a"
  },
  "locale": "en",
  "mode": "auto",
  "strings": {
    "back_home": "Back to Home",
    "cancel": "Cancel",
    "change_server": "Change address",
    "claim_busy": "Too many tries, wait a moment and press Connect again.",
    "claim_disabled": "The household dashboard is turned off in Social Home.",
    "claim_expired": "This connect request expired. Press Connect in Social Home again.",
    "claim_sealed": "This connect request can't be opened on this panel. Press Connect in Social Home again.",
    "claim_title": "Connect to Social Home",
    "claim_unreachable": "Can't reach Social Home at {host}.",
    "close": "Close",
    "connect": "Connect",
    "connecting": "Connecting to Social Home…",
    "credits": "Emoji: Twemoji © Twitter, Inc and other contributors, © jdecked and other contributors, CC-BY 4.0. Font: Roboto, SIL OFL 1.1. Firmware: MPL-2.0, built on ESPHome (GPLv3) and LVGL (MIT).",
    "delete": "Delete last digit",
    "empty_day": "Nothing planned today",
    "enter_pin": "Enter PIN",
    "forget": "Forget server",
    "forget_confirm": "Forget this Social Home? The panel shows the setup again and needs a new pairing code.",
    "found_looking": "Looking for Social Home on this network…",
    "found_none": "None found yet. Using the Home Assistant App? Type its address below.",
    "found_title": "Found on this network",
    "got_it": "Got it",
    "hear_rest": "tap to hear the rest",
    "improv_allow": "Allow",
    "improv_title": "A phone wants to set up Wi-Fi",
    "lock": "Lock screen",
    "locked": "Screen locked",
    "map_none": "No map picture on this Social Home — the list shows who's where.",
    "map_placeholder": "The map comes with a Social Home update.",
    "map_show_all": "Show everyone",
    "map_title": "Who's where",
    "message_for_everyone": "Message for everyone",
    "message_for_you": "Message for you",
    "nav_home": "Home",
    "nav_label": "People",
    "new": "new",
    "night_today": "Today",
    "night_tomorrow": "Tomorrow",
    "night_wake": "Tap to show the dashboard",
    "not_found": "This page isn't on the dashboard.",
    "offline": "Can't reach Social Home — showing info from {time}",
    "ok": "OK",
    "pair_busy": "Too many pairing attempts. Trying again shortly…",
    "pair_expired": "The code expired — getting a new one…",
    "pair_hint": "In Social Home, open Admin › Dashboard › Wall panels › Add a panel and enter this code:",
    "pair_title": "Pair this panel",
    "pair_unreachable": "Can't reach Social Home at this address.",
    "pin_button": "PIN",
    "pin_offline": "Can't reach Social Home. Try again.",
    "pin_remaining": "Tries left: {n}",
    "pin_wait": "Too many tries. Try again in {n} s.",
    "read_aloud": "Read aloud",
    "retry": "Try again",
    "see_all": "See all",
    "server_ha": "Or adopt this panel in Home Assistant and press Connect in Social Home.",
    "server_invalid": "That doesn't look like an address. Try 192.168.1.20 or socialhome.local.",
    "server_placeholder": "192.168.1.20 or socialhome.local",
    "server_text": "Type the address of your Social Home. The dashboard port 8100 is added for you.",
    "server_text_found": "Tap your Social Home, or type its address. The dashboard port 8100 is added for you.",
    "server_title": "Find Social Home",
    "settings_firmware": "Firmware",
    "settings_panel": "Panel",
    "settings_server": "Social Home",
    "settings_title": "Panel settings",
    "tab_map": "Map",
    "tab_messages": "Messages",
    "tab_notes": "Notes",
    "tab_overview": "Overview",
    "tabs_label": "Home",
    "timeline_now": "now",
    "unlock": "Unlock",
    "unpaired": "This panel isn't paired any more. Pair it again in Admin › Dashboard.",
    "update_text": "Your Social Home speaks a newer panel API. Update the panel's firmware from Home Assistant or the web installer.",
    "update_title": "This panel needs an update",
    "wifi_text": "Use Improv to give the panel your Wi-Fi: the web installer asks right after flashing, or a phone sends it over Bluetooth (Home Assistant finds the panel, or open improv-wifi.com). Tap Allow when the panel asks.",
    "wifi_title": "Connect the panel to Wi-Fi",
    "wifi_waiting": "Waiting for Wi-Fi…",
    "wrong_pin": "Wrong PIN"
  }
}
